{
  "$schema": "http://json-schema.org/draft-07/schema#",
  "title": "Grantha Part Schema",
  "description": "Schema for a single content part of a multi-part edition. Contains content arrays and identifiers. Versioned using semantic versioning.",
  "type": "object",
  "properties": {
    "schema_version": {
      "type": "string",
      "pattern": "^\\d+\\.\\d+\\.\\d+$",
      "description": "Version of this schema in semver format (MAJOR.MINOR.PATCH). Major version changes indicate breaking schema changes."
    },
    "edition_id": {
      "type": "string",
      "pattern": "^[a-z0-9-]+$",
      "description": "The ID of the edition this part belongs to."
    },
    "grantha_id": {
      "type": "string",
      "pattern": "^[a-z0-9-]+$",
      "description": "The ID of the parent grantha. Optional; derivable from the edition_id in most cases."
    },
    "part_num": {
      "description": "The sequential number of this part within the edition.",
      "type": "integer",
      "minimum": 1
    },
    "prefatory_material": {
      "type": "array",
      "items": { "$ref": "grantha.schema.json#/definitions/passage" }
    },
    "passages": {
      "type": "array",
      "items": { "$ref": "grantha.schema.json#/definitions/passage" }
    },
    "concluding_material": {
      "type": "array",
      "items": { "$ref": "grantha.schema.json#/definitions/passage" }
    },
    "commentary": {
      "$ref": "grantha.schema.json#/definitions/commentary",
      "description": "Exactly one commentary per edition part. Absent if this is a mūla-only edition."
    }
  },
  "required": ["schema_version", "edition_id", "part_num"],
  "additionalProperties": false
}
