{
  "schema_version": "1.0.0",
  "grantha_id": "prashna-upanishad",
  "edition_id": "prashna-upanishad",
  "part_num": 6,
  "passages": [
    {
      "ref": "6.1",
      "passage_type": "main",
      "content": {
        "sanskrit": {
          "devanagari": "**अथ हैनं सुकेशा भारद्वाजः पप्रच्छ । भगवन् ! हिरण्यनाभ: कौसल्यो राजपुत्रो मामुपेत्यैनं प्रश्नम् अपृच्छत षोडशकलं भारद्वाज ! पुरुषं वेत्थ इति । तमहं कुमारम् अब्रुवम् नाहमिमं वेद । यद्यहमिमवेदिषम् कथं ते नावक्ष्यमिति । समूलो वा एष परिशुष्यति, योऽनृतमभिवदति । तस्मानार्हाम्यनृतं वक्तुम् । स तूष्णीं रथमारुह्य प्रवव्राज । तं त्वा पृच्छामि, क्वासौ पुरुष इति **"
        }
      }
    },
    {
      "ref": "6.2",
      "passage_type": "main",
      "content": {
        "sanskrit": {
          "devanagari": "\\*\\*तस्मै स होवाच । इहैवान्तश्शरीरे सोम्य स पुरुषः, यस्मिन्नेताः षोडशकला: प्रभवन्तीति ।।२।।"
        }
      }
    },
    {
      "ref": "6.3",
      "passage_type": "main",
      "content": {
        "sanskrit": {
          "devanagari": "\\*\\*स ईक्षांचक्रे । कस्मिन्नहमुत्क्रान्त उत्क्रान्तो भविष्यामि, कस्मिन् वा प्रतिष्ठिते प्रतिष्ठास्यामीति ।।३।।"
        }
      }
    },
    {
      "ref": "6.4",
      "passage_type": "main",
      "content": {
        "sanskrit": {
          "devanagari": "**स प्राणमसृजत प्राणाच्छ्रद्धां खं वायुर्योतिरापः पृथिवीन्द्रियम् मनोऽन्नमत्राद्वीर्य तपो मन्त्राः कर्म लोका लोकेषु च नाम च **"
        }
      }
    },
    {
      "ref": "6.5",
      "passage_type": "main",
      "content": {
        "sanskrit": {
          "devanagari": "**स यथेमा नद्यः स्यन्दमानाः समुद्रायणाः समुद्रं प्राप्यास्तं गच्छन्ति, भिद्येते तासां नामरूपे, समुद्र इत्येवं प्रोच्यते – एवमेवास्य परिद्रष्टुरिमाः षोडशकलाः पुरुषायणाः पुरुषं प्राप्यास्तं गच्छन्ति ; भिद्येते तासां नामरूपे, पुरुष इत्येवं प्रोच्यते । स एषोकलोऽमृतो भवति । तदेष श्लोकः **"
        }
      }
    },
    {
      "ref": "6.6",
      "passage_type": "main",
      "content": {
        "sanskrit": {
          "devanagari": "**अरा इव रथनाभौ कला यस्मिन् प्रतिष्ठिताः । तं वेद्यं पुरुषं वेद मा वो मृत्युः परिव्यथा इति ।।**"
        }
      }
    },
    {
      "ref": "6.7",
      "passage_type": "main",
      "content": {
        "sanskrit": {
          "devanagari": "**तान् होवाच – एतावदेवाहमेतत् परं ब्रह्म वेद, नातः परमस्तीति ।।**"
        }
      }
    },
    {
      "ref": "6.8",
      "passage_type": "main",
      "content": {
        "sanskrit": {
          "devanagari": "\\*\\*ते तमर्चयन्तः त्वं हि नः पिता योऽस्माकमविद्यायाः परं पारं तारयसीति । नमः परमऋषिभ्यो नमः परमऋषिभ्यः ।।८।।"
        }
      }
    }
  ],
  "commentary": {
    "commentary_id": "rangaramanuja-muni-prakashika",
    "commentary_title": "प्रकाशिका",
    "commentator": {
      "devanagari": "श्रीरङ्गरामानुजमुनिः",
      "roman": ""
    },
    "passages": [
      {
        "ref": "6.1",
        "content": {
          "sanskrit": {
            "devanagari": "अथ हैनं सुकेशा इत्यादि । हे भगवन् ! हिरण्यनाभनामा कोसलदेशाधिपती राजपुत्रो मत्समीपमागत्य इमं वक्ष्यमाणं प्रश्नं कृतवान् । हे भारद्वाज । इति मां ‘सम्बोध्य प्राणाद्याः नामान्ता: षोडशकला यस्य स षोडशकलः, तं पुरुषं वेत्थ – जानासि किमिति इत्यर्थः । तम्-राजकुमारम् अहमेव मुक्तवान् , त्वदुक्तं पुरुषमहं न जानामि । यद्यहं जानीयाम् , केन हेतुना राजकुमाराय **योग्याय** **शिष्या** य न कथयिष्यामि इति । योऽनृतं ब्रूते, स मूलेन सह सर्वतः शुष्यति । श्रेयो हेतुभूतं पुण्यं सर्वमेव नश्यति इत्यर्थः । अतो मदुक्ते त्वयाऽनृतशंका न कार्येति भावः । प्रवव्राज – प्रकर्षण गतः । अनेन स्वल्पलज्जा’ सूचिता । रथेन प्रवव्राज इत्यनेन तस्य प्रभुत्वं सूचितम् । तमेव षोडशकलं पुरुषं पृच्छामि त्वाम् कासौ इति । क प्रदेशे तिष्ठति इत्यर्थः । अत्र आधारभूतदेशप्रश्नद्वारा जीवो वा परमात्मा वा इति निर्णयार्थोऽयं प्रश्न इति द्रष्टव्यम् ।।"
          }
        }
      },
      {
        "ref": "6.2",
        "content": {
          "sanskrit": {
            "devanagari": "तस्मै सहेति । इहैवान्तश्शरीरे सोम्य ! स पुरुषः यस्मिन्नेताष्षोडशकला: प्रभवन्ति । इहैवान्तश्शरीरे वर्तन्त इति शेषः । अनेन शरीरपरिच्छिन्नप्रदेशमात्राधारत्वोक्तया जीव इत्युक्तम् भवति ।\n\nननु जीवस्यैव कथं षोडशकलत्वम् ? षोडशकलाधारत्वतत्स्रष्टृत्वयोः ‘परमात्मन्येव पुष्कलत्वादित्याशंक्याह – यस्मिन् इति । यस्मिन् – पुरुषे, एताः – वक्ष्यमाणा: प्राणाद्या नामान्ताः षोडशकलाः स्वसंसर्गप्रयुक्तसुखदुःखादिभोगाख्यमुपकारं कर्तुम् , प्रभवन्ति – समर्था भवन्ति इत्यर्थः। ततश्च षोडशकलाभोक्तृत्वमेव षोडशकलत्वम् । तच्च जीवस्यैव इति भावः ।।"
          }
        }
      },
      {
        "ref": "6.3",
        "content": {
          "sanskrit": {
            "devanagari": "ननु षोडशकलासर्गहेतुत्वे जीवपरमात्मनोरविशिष्टे तद्भोक्तृत्वं जीवस्यैव न परमात्मन इत्यत्र किं नियामकमित्यत्राह – स ईक्षांचक्रे इत्यादि । इदं वाक्यं जीवाभिसन्धिप्रकारप्रदर्शनपरम् सोऽध्यक्षे तदुपगमादिभ्यः (ब्र.सू. ४-२-४) इति भाष्ये तथोक्तत्वात् मदुत्क्रान्तिप्रतिष्ठासहभूतोत्क्रान्तिप्रतिष्ठः को वेति पर्यालोचितवानित्यर्थः । ततश्च स्वोपकाराभिसन्धिपूर्वकं जीवस्य प्राणादिस्रष्टृत्वात्तभोक्तृत्वं सम्भवति परमात्मनस्तु –\n\nन च **माम्** **ता** नि क **र्माणि** **नि** बध्नन्ति धन **ञ्ज** य ।\n\nउदासीनवदासीनमसक्तं तेषु कर्म **सु** **।।** (**भ**.**गी**. ९-९)\n\nन मां कर्माणि लिम्पन्ति न मे कर्मफले स्पृहा । (भ.गी.४-१४)\n\nइत्युक्तरीत्या स्वोपकाराभिसन्धिपूर्वकस्रष्टृत्वाभावान्न तस्य षोडशकलाभोक्तृत्वमिति भावः ।।"
          }
        }
      },
      {
        "ref": "6.4",
        "content": {
          "sanskrit": {
            "devanagari": "स प्राणमसृजत इत्यादि । जीवः एवं पर्यालोच्य प्रथमतः स्वोत्क्रान्तिप्रतिष्ठ सहभूतोत्क्रान्तिप्रतिष्ठं मुख्यप्राणं सृष्टवान् । तस्मात् ‘श्रद्धाम् आस्तिक्यबुद्धिम् , पञ्चमहाभूतानि वागादीन्द्रियम् , मनः, व्रीह्यादिरूपम् अन्नम् , तदायत्तं शरीरेन्द्रियसामर्थ्यम् शरीरशोषणादिलक्षणम् तपः, ऋग्यजुःसामादीन् मन्त्रान् , ज्योतिष्टोमादीनि कर्माणि, कर्मफलभूतान् स्वर्गादीन् लोकान् , तेषु लोकेषु स्वर्गादि नामानि सृष्टवान् इत्यर्थः । यद्यपि षोडशकलास्रष्टृत्वं परमात्मन एव तथापि तद्धेतुभूतादृष्टारम्भककर्मकर्तृत्वेन अयं स्रष्टृत्ववाद इति द्रष्टव्यम् । ततश्च स्वभोगोपकारिकाः षोडशापि कलाः तद्धेतुभूतादृष्टारम्भककर्माणि कृत्वा सृष्टवान्। अतः तद्भोक्तृतया षोडशकलत्वं जीवस्य इति यावत् ।।"
          }
        }
      },
      {
        "ref": "6.5",
        "content": {
          "sanskrit": {
            "devanagari": "अथ परमात्मनः ईदृक्त्वाभावादकलत्वम् , तद्द्वारा मुमुक्षुवेद्यत्वं च उपपादयति – स यथेमा नद्यः इति । यथा – प्रस्रवन्त्यो गङ्गाद्याः, नद्यः समुद्रायणा: – ‘अयन शब्देन आधारत्वमुखेन आत्मत्वमुच्येत – समुद्रापृथक्स्थितिप्रतिपत्तियोग्या भूत्वा, समुद्रं प्राप्य अस्तं गच्छन्ति – अदर्शनं यान्ति, न तु समुद्रे वृद्धयादिलक्षणं विकारम् उत्पादयितुं प्रभवन्ति । तासां च गङ्गा यमुनादि नामानि यानि, यानि च शुक्लकृष्णादिरूपाणि प्राक्तनानि विभिद्यन्ते तत्प्रवेशानन्तरं नामान्तरं रूपान्तरं च भवति इत्यर्थः । तदेव दर्शयति – समुद्र इत्येवं प्रोच्यते इति । तत्प्रविष्टं नदीजातं सर्वं समुद्र इत्येव प्रोच्यते न त गङ्गायमुना इति । स यथा । स दृष्टान्तो यथा इत्यर्थः ।\n\nएवमेव अस्य परिद्रष्टुः – अनुभवितुर्भोक्तुर्जीवस्य भोगोपकरणभूता, इमाः – षोडशापि कला: निरुपाधिकपुरुषशब्दवाच्यं वासुदेवं प्राप्यास्तं गच्छन्ति – यथा शिलातलं प्राप्य क्षुरधारा: कुण्ठीभवन्ति, तथा भोगाधायिका न भवन्ति इत्यर्थः । तत्र हेतुमाह – पुरुषायणाः इति । पुरुषसंकल्पाधीन स्वरूपस्थितिप्रवृत्तिका इत्यर्थः । आसाम् कलानां जीवविषये भोग्य-भोग्यस्थान भोगोपकरणत्वादिनामरूपभेदवत् परमात्मविषये भोगस्थानत्वादि नामरूपे न स्तः। तदेव दर्शयति- पुरुष इत्येवमिति। पुरुषापृथक्स्थितिप्रतिपत्तिकतया पुरुष इत्येवं प्रोच्यते न तु तभिन्नत्वेन तद्भोग्यभोगस्थानत्वादिना तत्कला प्रोच्यते। स एष इति । तस्मात् परमात्मनः कलाभोक्तृत्वाभावात् अकल इत्येव उच्यते । अत एव अमृतश्च; मरणस्य भोक्तृत्वरूपकला सम्बन्धाधीनत्वादिति भावः । तदेष इति । तत् – परमात्मनस्स्वरूपम् अधिकृत्य वक्ष्यमाणः, श्लोकः प्रवृत्त इत्यर्थः ।।"
          }
        }
      },
      {
        "ref": "6.6",
        "content": {
          "sanskrit": {
            "devanagari": "अरा इव इति । यस्मिन् प्रतिष्ठिता: यदात्मिका: ‘यदुपादाना’ इत्यर्थः । यथावत् तमेव पुरुषं मुमुक्षुवेद्यम् अवगच्छत । ब्रह्मज्ञानस्य फलमाह – मा वो मृत्युरिति । व: ब्रह्मज्ञानां युष्माकं परितो व्यथा: मृत्युः मा कार्षीत् इत्यर्थः ।।"
          }
        }
      },
      {
        "ref": "6.7",
        "content": {
          "sanskrit": {
            "devanagari": "तान् होवाच इति । तान् – सुकेशादीन् षडपि शिष्यान् प्रति एतत् उवाच अहमेतावदेव परं ब्रह्म जानामि । परब्रह्मविषये ममैतावदेव ज्ञानम् । इतोऽधिकं नास्तीत्यर्थः ।।"
          }
        }
      },
      {
        "ref": "6.8",
        "content": {
          "sanskrit": {